<?xml version="1.0" encoding="utf-8"?>
<!--XML file automatically generated by WorkVisual V6.0.31_Build3247.-->
<!--DO NOT EDIT-->
<Supply xsi:noNamespaceSchemaLocation="../../../System/Common/Schemes/Supply.xsd" xmlns:xsi="http://www.w3.org/2001/XMLSchema-instance">
  <!--#############################################################-->
  <!--########                                             ########-->
  <!--########                 SUPPLY-FILE                 ########-->
  <!--########             KUKA DEUTSCHLAND GMBH           ########-->
  <!--########                                             ########-->
  <!--#############################################################-->
  <!--ATB 3.0.7, DB V8.521, ID 1000003, V8.7.4-->
  <!--Datum: 17-Mar-2022 06:45:07-->
  <!--Control: KPP600-67L-->
  <Info BallastPower="3200" Device="KPP600-67L" PrimaryVoltage="380" />
  <SupplyModes>
    <SupplyMode Setup="DC">
      <CurrentMonitoring>
        <Monitor MaxCurrent="150" Time="1" />
        <Monitor MaxCurrent="53" Time="30" />
        <Monitor MaxCurrent="25" Time="60" />
      </CurrentMonitoring>
      <Config ServoFile="ServoFile/S_KPP600-67L_380V_3200.xml" />
      <EnergyData>
        <b i="1" value="600.0" />
        <b i="2" value="0.250" />
        <b i="3" value="11.00" />
        <b i="4" value="775.0" />
        <b i="5" value="755.0" />
        <b i="6" value="5.000" />
        <b i="7" value="2.000" />
        <b i="8" value="0.000200" />
        <b i="9" value="1" />
      </EnergyData>
    </SupplyMode>
    <SupplyMode Setup="AC">
      <CurrentMonitoring>
        <Monitor MaxCurrent="150" Time="1" />
        <Monitor MaxCurrent="53" Time="30" />
        <Monitor MaxCurrent="25" Time="60" />
      </CurrentMonitoring>
      <Config ServoFile="ServoFile/S_KPP600-67L_380V_3200.xml" />
      <EnergyData>
        <b i="1" value="560.0" />
        <b i="2" value="0.750" />
        <b i="3" value="11.00" />
        <b i="4" value="775.0" />
        <b i="5" value="755.0" />
        <b i="6" value="5.000" />
        <b i="7" value="2.000" />
        <b i="8" value="0.000200" />
        <b i="9" value="0.002" />
      </EnergyData>
    </SupplyMode>
  </SupplyModes>
</Supply>